{
  "id": "SPC-003",
  "type": "feature_requirement",
  "status": "draft",
  "title": "CLI Contract (MVP)",
  "body_md_path": "spec/20-cli-contract.md",
  "terms": [],
  "hash": "c31ac153c8bfbec5c6538f9838059d610bf8f92cf08493a768e7283803591067",
  "edges": [
    {
      "to": "SPC-002",
      "type": "tests",
      "rationale": "cli validates model",
      "confidence": 1.0,
      "status": "confirmed"
    }
  ]
}
